{
  "schema_version": 1,
  "code": "DTF-7K3F",
  "created_at": "2026-09-23T14:05:00Z",
  "customer": { "name": "Fulano", "whatsapp": "31999999999" },
  "note": "Entrega sexta",
  "catalog_version": "2026-09-20T10:00:00Z",
  "items": [
    {
      "team_id": "atletico_mineiro",
      "team_name": "Atletico Mineiro",
      "season": 2026,
      "model_id": "home_1_2026",
      "model_name": "Home 1",
      "category_id": "numero_costas",
      "category_name": "Número Costas",
      "item_label": "10",
      "quantity": 2
    }
  ]
}
